Category,Description,Rate,Count of StudentsParticipated in Algebra II,Passed Algebra II,0.68,43622Participated in Algebra II,Did not Take/Failed Algebra II,0.32,20612Enrolled in College,Passed Algebra II and Enrolled in College,0.78,34027Enrolled in College,Did not Take/Failed Algebra II and Enrolled in College,0.49,10122Remained in College,Passed Algebra II and Remained in College after 1 year,0.71,30784Remained in College,Did not Take/Failed Algebra II and Remained in College after 1 year,0.38,7911